{
  "$schema": "./DENSITY_COVERAGE_CONTRACT.schema.json",
  "schemaVersion": 1,
  "status": "active",
  "authority": {
    "decisionMode": "curated-id-register",
    "newEntryPolicy": "fail-until-owner-classified",
    "evidenceUpdatePolicy": "regenerate-source-facts-only"
  },
  "source": {
    "componentRegistry": "docs/components/component-content.json",
    "componentRegistryFingerprint": "c2cfe382c91426405a8c3dba3a0c0d62d445a2ddd8c01ee86df0bc46f2407b72",
    "expressionProfileContract": "docs/references/architecture/EXPRESSION_PROFILE_CONTRACT.json",
    "expressionProfileContractFingerprint": "88c3fd6a5eb8fb61896af87aa266ab3bf93cae9195c7b6eefd911d566c0a1b5c"
  },
  "summary": {
    "entryCount": 214,
    "categoryCounts": {
      "profile-token-automatic": 7,
      "explicit-size-density": 96,
      "fixed": 96,
      "not-applicable": 15
    },
    "profileAwareEntries": 101
  },
  "entries": [
    {
      "id": "brand-logo",
      "title": "BrandLogo",
      "source": "components/brand/BrandLogo.jsx",
      "ownerLayer": "product",
      "category": "explicit-size-density",
      "profileAware": false,
      "explicitAxes": [
        "size"
      ],
      "profileTokens": []
    },
    {
      "id": "lockup",
      "title": "Lockup",
      "source": "components/brand/Lockup.jsx",
      "ownerLayer": "theme",
      "category": "fixed",
      "profileAware": false,
      "explicitAxes": [],
      "profileTokens": [],
      "owner": "LDS Theme owner",
      "rationale": "현재 공개 계약에는 profile geometry token 또는 명시적 size/density 축이 없으며 기본 geometry를 고정해 기존 소비자 출력을 보존한다.",
      "reviewTrigger": "대표 consumer에서 반복 geometry를 profile 또는 local density에 따라 달리해야 한다는 승인된 evidence가 생길 때",
      "nextReview": "2026-11-22"
    },
    {
      "id": "product-lockup",
      "title": "ProductLockup",
      "source": "components/brand/ProductLockup.jsx",
      "ownerLayer": "theme",
      "category": "explicit-size-density",
      "profileAware": true,
      "explicitAxes": [
        "compact"
      ],
      "profileTokens": [
        "--dur-base"
      ]
    },
    {
      "id": "action-area",
      "title": "ActionArea",
      "source": "components/buttons/ActionArea.jsx",
      "ownerLayer": "core",
      "category": "explicit-size-density",
      "profileAware": true,
      "explicitAxes": [
        "compact"
      ],
      "profileTokens": [
        "--component-action-area-gap",
        "--component-action-area-padding-x",
        "--component-action-area-padding-y"
      ]
    },
    {
      "id": "button",
      "title": "Button",
      "source": "components/buttons/Button.jsx",
      "ownerLayer": "core",
      "category": "explicit-size-density",
      "profileAware": true,
      "explicitAxes": [
        "size"
      ],
      "profileTokens": [
        "--component-button-height-lg",
        "--component-button-height-md",
        "--component-button-height-sm"
      ]
    },
    {
      "id": "button-group",
      "title": "ButtonGroup",
      "source": "components/buttons/ButtonGroup.jsx",
      "ownerLayer": "product",
      "category": "explicit-size-density",
      "profileAware": true,
      "explicitAxes": [
        "size"
      ],
      "profileTokens": [
        "--component-button-height-lg",
        "--component-button-height-md",
        "--component-button-height-sm"
      ]
    },
    {
      "id": "copy-button",
      "title": "CopyButton",
      "source": "components/buttons/CopyButton.jsx",
      "ownerLayer": "product",
      "category": "explicit-size-density",
      "profileAware": false,
      "explicitAxes": [
        "size"
      ],
      "profileTokens": []
    },
    {
      "id": "fab",
      "title": "Fab",
      "source": "components/buttons/Fab.jsx",
      "ownerLayer": "core",
      "category": "explicit-size-density",
      "profileAware": true,
      "explicitAxes": [
        "size"
      ],
      "profileTokens": [
        "--shadow-md"
      ]
    },
    {
      "id": "icon-button",
      "title": "IconButton",
      "source": "components/buttons/IconButton.jsx",
      "ownerLayer": "core",
      "category": "explicit-size-density",
      "profileAware": true,
      "explicitAxes": [
        "size"
      ],
      "profileTokens": [
        "--component-icon-button-size-md",
        "--component-icon-button-size-sm"
      ]
    },
    {
      "id": "link",
      "title": "Link",
      "source": "components/buttons/Link.jsx",
      "ownerLayer": "core",
      "category": "fixed",
      "profileAware": false,
      "explicitAxes": [],
      "profileTokens": [],
      "owner": "LDS Core owner",
      "rationale": "현재 공개 계약에는 profile geometry token 또는 명시적 size/density 축이 없으며 기본 geometry를 고정해 기존 소비자 출력을 보존한다.",
      "reviewTrigger": "대표 consumer에서 반복 geometry를 profile 또는 local density에 따라 달리해야 한다는 승인된 evidence가 생길 때",
      "nextReview": "2026-11-22"
    },
    {
      "id": "social-button",
      "title": "SocialButton",
      "source": "components/buttons/SocialButton.jsx",
      "ownerLayer": "product",
      "category": "fixed",
      "profileAware": false,
      "explicitAxes": [],
      "profileTokens": [],
      "owner": "LDS Product owner",
      "rationale": "현재 공개 계약에는 profile geometry token 또는 명시적 size/density 축이 없으며 기본 geometry를 고정해 기존 소비자 출력을 보존한다.",
      "reviewTrigger": "대표 consumer에서 반복 geometry를 profile 또는 local density에 따라 달리해야 한다는 승인된 evidence가 생길 때",
      "nextReview": "2026-11-22"
    },
    {
      "id": "speed-dial",
      "title": "SpeedDial",
      "source": "components/buttons/SpeedDial.jsx",
      "ownerLayer": "product",
      "category": "fixed",
      "profileAware": true,
      "explicitAxes": [],
      "profileTokens": [
        "--dur-fast",
        "--shadow-md",
        "--shadow-sm"
      ],
      "owner": "LDS Product owner",
      "rationale": "현재 공개 계약에는 profile geometry token 또는 명시적 size/density 축이 없으며 기본 geometry를 고정해 기존 소비자 출력을 보존한다.",
      "reviewTrigger": "대표 consumer에서 반복 geometry를 profile 또는 local density에 따라 달리해야 한다는 승인된 evidence가 생길 때",
      "nextReview": "2026-11-22"
    },
    {
      "id": "split-button",
      "title": "SplitButton",
      "source": "components/buttons/SplitButton.jsx",
      "ownerLayer": "product",
      "category": "explicit-size-density",
      "profileAware": true,
      "explicitAxes": [
        "size"
      ],
      "profileTokens": [
        "--component-button-height-lg",
        "--component-button-height-md",
        "--component-button-height-sm",
        "--component-menu-padding-x",
        "--component-menu-padding-y",
        "--shadow-md"
      ]
    },
    {
      "id": "text-button",
      "title": "TextButton",
      "source": "components/buttons/TextButton.jsx",
      "ownerLayer": "core",
      "category": "explicit-size-density",
      "profileAware": false,
      "explicitAxes": [
        "size"
      ],
      "profileTokens": []
    },
    {
      "id": "toggle-icon",
      "title": "ToggleIcon",
      "source": "components/buttons/ToggleIcon.jsx",
      "ownerLayer": "core",
      "category": "explicit-size-density",
      "profileAware": false,
      "explicitAxes": [
        "size"
      ],
      "profileTokens": []
    },
    {
      "id": "card",
      "title": "Card",
      "source": "components/cards/Card.jsx",
      "ownerLayer": "core",
      "category": "explicit-size-density",
      "profileAware": true,
      "explicitAxes": [
        "padding",
        "density"
      ],
      "profileTokens": [
        "--component-card-padding",
        "--shadow-md",
        "--shadow-sm"
      ]
    },
    {
      "id": "checklist-item",
      "title": "ChecklistItem",
      "source": "components/cards/ChecklistItem.jsx",
      "ownerLayer": "product",
      "category": "fixed",
      "profileAware": false,
      "explicitAxes": [],
      "profileTokens": [],
      "owner": "LDS Product owner",
      "rationale": "현재 공개 계약에는 profile geometry token 또는 명시적 size/density 축이 없으며 기본 geometry를 고정해 기존 소비자 출력을 보존한다.",
      "reviewTrigger": "대표 consumer에서 반복 geometry를 profile 또는 local density에 따라 달리해야 한다는 승인된 evidence가 생길 때",
      "nextReview": "2026-11-22"
    },
    {
      "id": "feature-card",
      "title": "FeatureCard",
      "source": "components/cards/FeatureCard.jsx",
      "ownerLayer": "product",
      "category": "explicit-size-density",
      "profileAware": true,
      "explicitAxes": [
        "density"
      ],
      "profileTokens": [
        "--component-card-padding"
      ]
    },
    {
      "id": "feed-card",
      "title": "FeedCard",
      "source": "components/cards/FeedCard.jsx",
      "ownerLayer": "product",
      "category": "fixed",
      "profileAware": false,
      "explicitAxes": [],
      "profileTokens": [],
      "owner": "LDS Product owner",
      "rationale": "현재 공개 계약에는 profile geometry token 또는 명시적 size/density 축이 없으며 기본 geometry를 고정해 기존 소비자 출력을 보존한다.",
      "reviewTrigger": "대표 consumer에서 반복 geometry를 profile 또는 local density에 따라 달리해야 한다는 승인된 evidence가 생길 때",
      "nextReview": "2026-11-22"
    },
    {
      "id": "listing-card",
      "title": "ListingCard",
      "source": "components/cards/ListingCard.jsx",
      "ownerLayer": "product",
      "category": "fixed",
      "profileAware": true,
      "explicitAxes": [],
      "profileTokens": [
        "--dur-base",
        "--shadow-md"
      ],
      "owner": "LDS Product owner",
      "rationale": "현재 공개 계약에는 profile geometry token 또는 명시적 size/density 축이 없으며 기본 geometry를 고정해 기존 소비자 출력을 보존한다.",
      "reviewTrigger": "대표 consumer에서 반복 geometry를 profile 또는 local density에 따라 달리해야 한다는 승인된 evidence가 생길 때",
      "nextReview": "2026-11-22"
    },
    {
      "id": "metric-card",
      "title": "MetricCard",
      "source": "components/cards/MetricCard.jsx",
      "ownerLayer": "product",
      "category": "fixed",
      "profileAware": false,
      "explicitAxes": [],
      "profileTokens": [],
      "owner": "LDS Product owner",